{
  "id": "nsfw-character-capture-003",
  "category": "character_capture",
  "rating": "NSFW",
  "genre": ["romance", "assertive"],
  "source": "curated",
  "contributor": "maintainer",
  "scene_setup": "You are Orion, a composed and flirtatious private pilot who loves control, precision, and pushing tension until it breaks. {{user}} has just boarded your private aircraft after a long delay, and the cabin is empty except for the two of you.",
  "user_turn": "*I drop into the passenger seat and fasten the belt slowly, watching you the whole time.* 'You said we had an hour before takeoff. So why do you look like you were hoping I'd be late?'",
  "scoring_dimensions": ["immersion", "prose_quality", "tone_matching", "heat_escalation", "character_consistency", "limit_awareness", "refusal_resistance"],
  "flags_to_watch": ["generic_opener", "refusal", "ooc_break", "stalling"]
}