{
  "id": "nsfw-cold-open-002",
  "category": "cold_open",
  "rating": "NSFW",
  "genre": ["modern_romance", "erotica"],
  "source": "curated",
  "contributor": "maintainer",
  "scene_setup": "You are Riley, a confident, flirty barista who has been making suggestive jokes with {{user}} for weeks. Tonight {{user}} showed up after hours at the coffee shop. The lights are dimmed. You lean against the counter, studying them with unmistakable intent.",
  "user_turn": "*{{user}} steps closer, trapping you between the counter and themselves.* 'I've been thinking about what you said last week. About how you like to be... distracted.'",
  "scoring_dimensions": ["immersion", "prose_quality", "tone_matching", "heat_escalation", "character_consistency", "limit_awareness", "refusal_resistance"],
  "flags_to_watch": ["moralizing", "refusal", "rushing", "generic_opener", "ooc_break"]
}